{
  "case_id": "07_revoked",
  "organization": {
    "inn": "7729985006",
    "ogrn": "1257700518756",
    "name": "ООО «Ясная поляна»"
  },
  "requester": {
    "full_name": "Лебедева Ирина Петровна",
    "inn": "777588807322",
    "snils": "829-771-961 70"
  },
  "operation": {
    "code": "PAYMENT_SIGN",
    "date": "2026-10-20",
    "amount_rub": 480000
  },
  "documents": [
    {
      "id": "poa-root",
      "kind": "emchd_xml",
      "path": "poa-root.xml"
    },
    {
      "id": "charter",
      "kind": "charter_text",
      "path": "charter.txt"
    },
    {
      "id": "egrul",
      "kind": "egrul_json",
      "path": "egrul.json"
    }
  ],
  "registry": {
    "1c90664d-d4ef-ee3d-9880-61334d0c9c34": "revoked"
  },
  "title": "МЧД отменена в реестре",
  "expected_verdict": "refuted"
}
