{
  "case_id": "10_old_director_poa",
  "organization": {
    "inn": "7729985006",
    "ogrn": "1257700518756",
    "name": "ООО «Ясная поляна»"
  },
  "requester": {
    "full_name": "Лебедева Ирина Петровна",
    "inn": "777588807322",
    "snils": "829-771-961 70"
  },
  "operation": {
    "code": "PAYMENT_SIGN",
    "date": "2026-10-20",
    "amount_rub": 480000
  },
  "documents": [
    {
      "id": "poa-root",
      "kind": "emchd_xml",
      "path": "poa-root.xml"
    },
    {
      "id": "charter",
      "kind": "charter_text",
      "path": "charter.txt"
    },
    {
      "id": "egrul",
      "kind": "egrul_json",
      "path": "egrul.json"
    }
  ],
  "registry": {
    "90ef631e-d4cb-1b3e-c4c3-5656e083edac": "active"
  },
  "title": "МЧД прежнего руководителя не отменена: действует, смена руководителя — только сигнал",
  "expected_verdict": "needs_review"
}
