{
  "case_id": "01_ok",
  "organization": {
    "inn": "7729985006",
    "ogrn": "1257700518756",
    "name": "ООО «Ясная поляна»"
  },
  "requester": {
    "full_name": "Лебедева Ирина Петровна",
    "inn": "777588807322",
    "snils": "829-771-961 70"
  },
  "operation": {
    "code": "PAYMENT_SIGN",
    "date": "2026-10-20",
    "amount_rub": 480000
  },
  "documents": [
    {
      "id": "poa-root",
      "kind": "emchd_xml",
      "path": "poa-root.xml"
    },
    {
      "id": "charter",
      "kind": "charter_text",
      "path": "charter.txt"
    },
    {
      "id": "egrul",
      "kind": "egrul_json",
      "path": "egrul.json"
    }
  ],
  "registry": {
    "71ad2f2e-9941-cb17-2164-f172376af807": "active"
  },
  "title": "Новый бухгалтер: МЧД действует, полномочие покрывает подписание платёжек",
  "expected_verdict": "confirmed"
}
