{
  "case_id": "11_parent_revoked",
  "organization": {
    "inn": "7729985006",
    "ogrn": "1257700518756",
    "name": "ООО «Ясная поляна»"
  },
  "requester": {
    "full_name": "Лебедева Ирина Петровна",
    "inn": "777588807322",
    "snils": "829-771-961 70"
  },
  "operation": {
    "code": "PAYMENT_SIGN",
    "date": "2026-10-20",
    "amount_rub": 480000
  },
  "documents": [
    {
      "id": "poa-root",
      "kind": "emchd_xml",
      "path": "poa-root.xml"
    },
    {
      "id": "poa-child",
      "kind": "emchd_xml",
      "path": "poa-child.xml"
    },
    {
      "id": "charter",
      "kind": "charter_text",
      "path": "charter.txt"
    },
    {
      "id": "egrul",
      "kind": "egrul_json",
      "path": "egrul.json"
    }
  ],
  "registry": {
    "fb860cab-50c1-04f3-b1c3-4176720e53a8": "revoked",
    "e66a6a3e-6062-4536-2cff-e60bc7bb68a5": "active"
  },
  "title": "Основная МЧД отменена — передоверие теряет силу",
  "expected_verdict": "refuted"
}
