{
  "case_id": "03_subdelegation_ok",
  "organization": {
    "inn": "7729985006",
    "ogrn": "1257700518756",
    "name": "ООО «Ясная поляна»"
  },
  "requester": {
    "full_name": "Лебедева Ирина Петровна",
    "inn": "777588807322",
    "snils": "829-771-961 70"
  },
  "operation": {
    "code": "PAYMENT_SIGN",
    "date": "2026-10-20",
    "amount_rub": 480000
  },
  "documents": [
    {
      "id": "poa-root",
      "kind": "emchd_xml",
      "path": "poa-root.xml"
    },
    {
      "id": "poa-child",
      "kind": "emchd_xml",
      "path": "poa-child.xml"
    },
    {
      "id": "charter",
      "kind": "charter_text",
      "path": "charter.txt"
    },
    {
      "id": "egrul",
      "kind": "egrul_json",
      "path": "egrul.json"
    }
  ],
  "registry": {
    "ee2afcb0-9003-7ff0-ef03-8dad405558ea": "active",
    "f3c69a25-a0a0-3e35-723f-2ad0f5e063e7": "active"
  },
  "title": "Передоверие в пределах полномочий и срока",
  "expected_verdict": "needs_review"
}
