{
  "case_id": "14_old_director_charter_cleared",
  "organization": {
    "inn": "7729985006",
    "ogrn": "1257700518756",
    "name": "ООО «Ясная поляна»"
  },
  "requester": {
    "full_name": "Лебедева Ирина Петровна",
    "inn": "777588807322",
    "snils": "829-771-961 70"
  },
  "operation": {
    "code": "PAYMENT_SIGN",
    "date": "2026-10-20",
    "amount_rub": 480000
  },
  "documents": [
    {
      "id": "poa-root",
      "kind": "emchd_xml",
      "path": "poa-root.xml"
    },
    {
      "id": "charter",
      "kind": "charter_text",
      "path": "charter.txt"
    },
    {
      "id": "egrul",
      "kind": "egrul_json",
      "path": "egrul.json"
    }
  ],
  "registry": {
    "90ef631e-d4cb-1b3e-c4c3-5656e083edac": "active"
  },
  "title": "Кейс 10 с синтетической отметкой «по уставу применимых ограничений нет»: подтверждено, смена руководителя — сигнал",
  "expected_verdict": "confirmed",
  "charter_disposition": "no_applicable_restriction",
  "charter_disposition_note": "СИНТЕТИЧЕСКАЯ отметка для демонстрации: устав никто не проверял. В банке такую отметку ставит юрист после чтения устава, и она попадает в журнал вместе с его именем."
}
